{
  "base_branch": "main",
  "generated_at": "2026-09-04T02:09:05.859667+00:00",
  "nodes": [
    {
      "auto_executable": false,
      "definition": {
        "change_id": "add-model-usage-ledger",
        "changed_files": [
          ".claude/settings.json",
          "docs/decisions/agent-archetypes.md",
          "docs/decisions/evaluation-framework.md",
          "openspec/changes/add-model-usage-ledger/.openspec.yaml",
          "openspec/changes/add-model-usage-ledger/contracts/README.md",
          "openspec/changes/add-model-usage-ledger/contracts/db/schema.sql",
          "openspec/changes/add-model-usage-ledger/contracts/events/dispatch-record.schema.json",
          "openspec/changes/add-model-usage-ledger/contracts/events/usage-record.schema.json",
          "openspec/changes/add-model-usage-ledger/contracts/generated/models.py",
          "openspec/changes/add-model-usage-ledger/contracts/generated/types.ts",
          "openspec/changes/add-model-usage-ledger/contracts/openapi/v1.yaml",
          "openspec/changes/add-model-usage-ledger/design.md",
          "openspec/changes/add-model-usage-ledger/handoffs/plan-1.json",
          "openspec/changes/add-model-usage-ledger/proposal.md",
          "openspec/changes/add-model-usage-ledger/session-log.md",
          "openspec/changes/add-model-usage-ledger/specs/agent-archetypes/spec.md",
          "openspec/changes/add-model-usage-ledger/specs/agent-coordinator/spec.md",
          "openspec/changes/add-model-usage-ledger/specs/harness-engineering/spec.md",
          "openspec/changes/add-model-usage-ledger/specs/observability/spec.md",
          "openspec/changes/add-model-usage-ledger/specs/skill-workflow/spec.md",
          "openspec/changes/add-model-usage-ledger/specs/usage-accounting/spec.md",
          "openspec/changes/add-model-usage-ledger/tasks.md",
          "openspec/changes/add-model-usage-ledger/work-packages.yaml"
        ],
        "depends_on": [
          472
        ],
        "gates": [
          "proposal_acceptance"
        ],
        "kind": "plan",
        "remediation_skill": "iterate-on-plan"
      },
      "origin": "openspec",
      "pr": 468,
      "state": {
        "blocking_reason": null,
        "ci_state": "clean",
        "claimed_by": null,
        "needs_revalidation": false,
        "outcome": "merged",
        "staleness": "fresh",
        "unresolved_comment_summary": null,
        "unresolved_comments": 6,
        "vendor_verdict": {
          "accepted_at": "2026-09-30",
          "critical": [
            "every /usage/* GET was unauthenticated on a false claim about repo convention; /audit and /profiles/me both require the key",
            "principal accepted from the ingest request instead of derived from the API key",
            "specs still described the GETs as unauthenticated after the contract was fixed (regression from iteration 1)",
            "session_overhead had no contract representation; PhaseUsageRow requires fields it cannot have (regression from iteration 1)"
          ],
          "disposition": "accepted_and_merged",
          "final_ci": "26/26 pass, 1 skipped, on a base including #648",
          "findings_addressed": 24,
          "iterations": 2,
          "merge_strategy": "merge commit, not rebase: refresh-branch had introduced merge commits so GitHub refused a rebase. Squash would have collapsed the refinement history the rebase default exists to preserve; main already carries 47 merge commits in its last 200, including openspec PR #417.",
          "quorum": "2/2",
          "reviewed_at": "2026-09-04",
          "vendors_failed": [
            {
              "reason": "timeout at 600s",
              "vendor": "codex"
            },
            {
              "reason": "timeout at 600s",
              "vendor": "pi"
            }
          ],
          "vendors_succeeded": [
            "antigravity",
            "grok"
          ]
        }
      },
      "strategy": "rebase",
      "title": "plan: add-model-usage-ledger \u2014 end-to-end model usage observability"
    },
    {
      "auto_executable": false,
      "definition": {
        "change_id": "standardize-port-leases",
        "changed_files": [
          "docs/decisions/agent-coordinator.md",
          "docs/decisions/evaluation-framework.md",
          "openspec/changes/standardize-port-leases/.openspec.yaml",
          "openspec/changes/standardize-port-leases/README.md",
          "openspec/changes/standardize-port-leases/contracts/README.md",
          "openspec/changes/standardize-port-leases/contracts/db/schema.sql",
          "openspec/changes/standardize-port-leases/contracts/db/seed.sql",
          "openspec/changes/standardize-port-leases/contracts/openapi/v1.yaml",
          "openspec/changes/standardize-port-leases/contracts/schemas/port-lease-env.schema.json",
          "openspec/changes/standardize-port-leases/design.md",
          "openspec/changes/standardize-port-leases/handoffs/plan-1.json",
          "openspec/changes/standardize-port-leases/proposal.md",
          "openspec/changes/standardize-port-leases/session-log.md",
          "openspec/changes/standardize-port-leases/specs/agent-coordinator/spec.md",
          "openspec/changes/standardize-port-leases/specs/coordinator-kanban-viz/spec.md",
          "openspec/changes/standardize-port-leases/specs/live-service-testing/spec.md",
          "openspec/changes/standardize-port-leases/specs/port-lease-client/spec.md",
          "openspec/changes/standardize-port-leases/tasks.md",
          "openspec/changes/standardize-port-leases/work-packages.yaml"
        ],
        "depends_on": [
          468,
          472
        ],
        "gates": [
          "proposal_acceptance"
        ],
        "kind": "plan",
        "remediation_skill": "iterate-on-plan"
      },
      "origin": "openspec",
      "pr": 467,
      "state": {
        "blocking_reason": null,
        "ci_state": "clean",
        "claimed_by": null,
        "needs_revalidation": false,
        "outcome": "merged",
        "staleness": "fresh",
        "unresolved_comment_summary": null,
        "unresolved_comments": 5,
        "vendor_verdict": {
          "accepted_at": "2026-09-30",
          "critical": [
            "release/conflict had no ownership check while GET /ports/status publishes session_id unauthenticated",
            "reconcile applied one client's host report to every lease in the system",
            "host_id was added to schema/spec/reconcile but not to PortAllocateRequest, so it could never be set (regression from iteration 1)",
            "unknown-session conflict reports let any caller block any slot; block layout is arithmetic and predictable"
          ],
          "disposition": "accepted_and_merged",
          "final_ci": "26/26 pass, 1 skipped, on a base including #648",
          "findings_addressed": 23,
          "iterations": 2,
          "merge_strategy": "merge commit, not rebase: refresh-branch had introduced merge commits so GitHub refused a rebase. Squash would have collapsed the refinement history the rebase default exists to preserve; main already carries 47 merge commits in its last 200, including openspec PR #417.",
          "quorum": "2/2",
          "reviewed_at": "2026-09-04",
          "vendors_failed": [
            {
              "reason": "no parseable output",
              "vendor": "codex"
            },
            {
              "reason": "findings failed review-findings schema validation",
              "vendor": "pi"
            }
          ],
          "vendors_succeeded": [
            "antigravity",
            "grok"
          ]
        }
      },
      "strategy": "rebase",
      "title": "plan(standardize-port-leases): proposal, design, specs, tasks, contracts, work-packages"
    },
    {
      "auto_executable": false,
      "definition": {
        "changed_files": [
          "agent-coordinator/src/profiles.py",
          "agent-coordinator/src/work_queue.py",
          "agent-coordinator/tests/test_profiles.py",
          "agent-coordinator/tests/test_trust_resolution_fail_open.py"
        ],
        "depends_on": [
          472
        ],
        "gates": [
          "proposal_acceptance"
        ],
        "kind": "implementation",
        "remediation_skill": "iterate-on-implementation"
      },
      "origin": "openspec",
      "pr": 465,
      "state": {
        "blocking_reason": null,
        "ci_state": "clean",
        "claimed_by": null,
        "needs_revalidation": false,
        "outcome": "merged",
        "staleness": "fresh",
        "unresolved_comment_summary": null,
        "unresolved_comments": 1,
        "vendor_verdict": {
          "blocking_count": 0,
          "disposition": "merged",
          "findings": [
            {
              "disposition": "accepted",
              "evidence": "guardrails.py never raises or imports TrustResolutionError; the claim() try block calls only get_guardrails_service, check_operation and db.rpc",
              "rationale": "Deliberate symmetry across all three guardrail call sites. The PR's own test_every_guardrail_handler_re_raises_trust_failures asserts the handler exists at each site, and it re-arms if trust resolution is ever moved back inside the try. Vendor scored it non-blocking.",
              "summary": "except TrustResolutionError handler in claim() is unreachable after the hoist",
              "verified": true
            }
          ],
          "quorum": "2/2",
          "reviewed_at": "2026-09-04T03:00:00Z",
          "vendors_failed": [
            {
              "reason": "no parseable output",
              "vendor": "codex"
            },
            {
              "reason": "invalid JSON: concatenated objects",
              "vendor": "grok"
            }
          ],
          "vendors_succeeded": [
            "antigravity",
            "pi"
          ]
        }
      },
      "strategy": "rebase",